{
  "$schema": "./build.schema.json",
  "Solution": "FinancePortfolioDatabase.sln",
  "ExecutablePublishProjects": [
    "FPD.UI",
    "FPD.Console"
  ],
  "NugetPackageProjects": [
  ],
  "Configuration": "Release",
  "Framework": "net7.0-windows",
  "Runtime": "win-x64",
  "IsProd": true,
  "TagRepo": true,
  "PushTag": true,
  "TestProjects": [
    "Common.Structure.Tests",
    "Common.Console.Tests",
    "Common.UI.Tests",
    "Common.UI.Wpf.Tests",
    "FinancialStructures.Tests",
    "FPD.Logic.Tests",
    "FPD.Console.Tests"
  ]
}