{
  "$schema": "./build.schema.json",
  "Solution": "FinancePortfolioDatabase.sln",
  "ExecutablePublishProjects": [
    "FPD.UI",
    "FPD.Console"
  ],
  "NugetPackageProjects": [
    "FinancialStructures"
  ],
  "Configuration": "Release",
  "Framework": "net7.0-windows",
  "Runtime": "win-x64",
  "TagRepo": true,
  "PushTag": false,
  "TestProjects": [
    "FinancialStructures.Tests",
    "FPD.Logic.Tests"
  ]
}